{
  "doc_id": "2025-16089",
  "relevant": false,
  "confidence": 0.95,
  "change_type": "proposed_rule",
  "effective_date": null,
  "affected_register_rows": [],
  "behavior_classes": [],
  "what_changed": "FCC proposes modernizing or removing slamming and truth-in-billing rules for telecom carriers.",
  "compliant_agent_must_now": "No change.",
  "open_questions_for_deploying_team": [],
  "rationale": "Telecom billing rules; unrelated to lending. Stage A: title, abstract, metadata and eCFR diff excerpt only; full text not read."
}
