{
  "doc_id": "2024-23277",
  "relevant": false,
  "confidence": 0.95,
  "change_type": "final_rule",
  "effective_date": "2025-01-01",
  "affected_register_rows": [],
  "behavior_classes": [],
  "what_changed": "Annual adjustment of the higher-priced mortgage loan appraisal exemption threshold from $32,400 to $33,500.",
  "compliant_agent_must_now": "No change.",
  "open_questions_for_deploying_team": [],
  "rationale": "Mortgage origination appraisal rule, excluded by the relevance test. Stage A: title, abstract, metadata and eCFR diff excerpt only; full text not read."
}
