{
  "doc_id": "2026-03066",
  "relevant": false,
  "confidence": 0.93,
  "change_type": "final_rule",
  "effective_date": "2026-03-19",
  "affected_register_rows": [],
  "behavior_classes": [],
  "what_changed": "FCC adopts rules on direct access to telephone numbers by interconnected VoIP providers.",
  "compliant_agent_must_now": "No change.",
  "open_questions_for_deploying_team": [],
  "rationale": "Numbering access for providers; no lender or collector obligation. Stage A: title, abstract and metadata only; full text not read."
}
