{
  "doc_id": "FIXTURE-0010",
  "relevant": false,
  "confidence": 0.7,
  "change_type": "withdrawal",
  "effective_date": null,
  "affected_register_rows": [],
  "behavior_classes": [],
  "what_changed": "FDIC rescinded a statement of policy on bank merger transactions.",
  "compliant_agent_must_now": "No change.",
  "open_questions_for_deploying_team": [],
  "rationale": "Bank merger policy does not govern servicing conduct. Abstract only; confidence kept below the auto-close threshold because the full text was not reviewed."
}
