{
  "doc_id": "2024-23992",
  "relevant": false,
  "confidence": 0.97,
  "change_type": "other",
  "effective_date": null,
  "affected_register_rows": [],
  "behavior_classes": [],
  "what_changed": "FCC open meeting agenda for October 17, 2024 (hearing aid compatibility, 988 georouting, other items).",
  "compliant_agent_must_now": "No change.",
  "open_questions_for_deploying_team": [],
  "rationale": "Meeting notice; no consumer-lending item. Stage A: title, abstract and metadata only; full text not read."
}
