{
  "doc_id": "2025-20199",
  "relevant": false,
  "confidence": 0.95,
  "change_type": "proposed_rule",
  "effective_date": null,
  "affected_register_rows": [],
  "behavior_classes": [],
  "what_changed": "OCC proposes rescinding its recovery planning guidelines (12 CFR 30 appendix E).",
  "compliant_agent_must_now": "No change.",
  "open_questions_for_deploying_team": [],
  "rationale": "Bank recovery planning, excluded category. Stage A: title, abstract and metadata only; full text not read."
}
