{
  "doc_id": "2026-05213",
  "relevant": false,
  "confidence": 0.97,
  "change_type": "proposed_rule",
  "effective_date": null,
  "affected_register_rows": [],
  "behavior_classes": [],
  "what_changed": "FCC proposes modernizing internet-based telecommunications relay services rules.",
  "compliant_agent_must_now": "No change.",
  "open_questions_for_deploying_team": [],
  "rationale": "Relay services; unrelated to lending. Stage A: title, abstract, metadata and eCFR diff excerpt only; full text not read."
}
